"","text","score","klasifikasi"
"604","breaking news gareth southgate  decided   call  recce james   world cup",-1,"Negatif"
"605","breaking gareth southgate  decided   take  gamble  taking s reece james  theworld",-1,"Negatif"
"606","southgate finna start shaw  taa  world cup cant wait  iran  cook ",0,"Netral"
"607","will southgate playat  back  aat  back",0,"Netral"
"608","starting sterling  front  saka   political agenda  said indont want  boy running  legs o",0,"Netral"
"609"," im expecting southgate  go ",0,"Netral"
"610","     fucking next level deluded  think england  winning   southgate will mo",-1,"Negatif"
"611","right thing   even   unfortunatesouthgate    brain  ",1,"Positif"
"612","yet another reason     excited   lionesses  southgates bores theyre  focused  w",0,"Netral"
"613","andy southgate  terrible  passion  style just  old  old  stop feeling gutted  change  badly needed",-1,"Negatif"
"614","southgate  saving james career",0,"Netral"
"615"," really like barnes  southgate clearly doesnt    loads  players id  picking",2,"Positif"
"616","southgate  really  guy",0,"Netral"
"617","will   bumpy times  worth  risk taking   think     good coachmanager may",0,"Netral"
"618","theres literally zero hype  england   world cupsouthgate  single handedly broken  divided  nation go",-2,"Negatif"
"619","feel  bad    southgate decision  right",0,"Netral"
"620"," just thought may aswell put   coz theres  change  southgates mind     ",0,"Netral"
"621"," can kalvin phillips go   world cup   hasnt kicked  ball  months pointless taking phillips hender",-1,"Negatif"
"622","solid solid team except southgate  pussy  will play  back",2,"Positif"
"623","good decision  southgate",1,"Positif"
"624","southgates saved  career",0,"Netral"
"625","james got nothing  lose   like england  gonna win  world cup  southgate   charge",1,"Positif"
"626","tbf  clicked   article   defo  click baity linesouthgate says  box office appea",0,"Netral"
"627","gareth southgate  decided   take  gamble  taking s reece james  theworld cupsou",0,"Netral"
"628"," good thing southgate  done   managerial career",1,"Positif"
"629"," love southgate",1,"Positif"
"630"," already knew     wasnt waiting  southgate",0,"Netral"
"631"," think  offers   mount  mount   versatile  southgate loves ",2,"Positif"
"632","means southgate     chance  get  sack",-1,"Negatif"
"633","best bit  management southgate  ever done",1,"Positif"
"634","gareth southgate rang reece james  deliver  bad news  person telling     afford  take  risk",-1,"Negatif"
"635","meguire cos  know southgate will take   maguire cos   take ",0,"Netral"
"636","good southgate might  save  career",1,"Positif"
"637","good choice  southgate got  options  allows reece  rest",1,"Positif"
"638","maddison doesnt fit  team simple  just cos hes hit  bit  form doesnt mean   go h",0,"Netral"
"639","theres literally zero hype  england   world cupsouthgate  single handedly broken  divided ",-2,"Negatif"
"640","breaking reece james   given  devastating news  england boss gareth southgate   world cup dream   martin lipton",-2,"Negatif"
"641","idk  maddison id take     starting ahead  mount   starting  sterling sak",0,"Netral"
"642","whites best position isnt even centre back plus maguires england proven play white   already win",3,"Positif"
"643","name   history books englands cup runs might  worldwide b",0,"Netral"
"644","maguire coady stones rashford  grealish christ southgate    absolutely clueless  dog shit",-2,"Negatif"
"645","  fuck   toney guy       england squad im afraid   coming home  least  ",-2,"Negatif"
"646","id like nothing      gonna win  wanna      southgate way possible",2,"Positif"
"647","hopefully southgate will let go   backcause england definitely   chance despite  recent poor form",-1,"Negatif"
"648","southgates  guy   know   hope  plays maguire   midfield three  rice phillips bell",0,"Netral"
"649","  go  watching nigeball  watching southgate ball",0,"Netral"
"650","usa manager gives gareth southgate verdict ahead  world cuprivalry",0,"Netral"
"651","gareth southgate seeing james maddison putting  another man   match performance",0,"Netral"
"652","people write southgate  every time  even though   major doubts       well",0,"Netral"
"653","nobe southgate squad ai",0,"Netral"
"654","southgate na idiot",-1,"Negatif"
"655","errm   forgetting maguire  lack  match fitness  sluggish pace  essential  southgates defence",-2,"Negatif"
"656"," england team    good enough  give france   good game maybe even   favourites",3,"Positif"
"657","trent shouldnt   will return feeling shattered southgate doesnt trust   whats  business ",1,"Positif"
"658","things heat upanddo  think england  progressed  southgate",0,"Netral"
"659","southgate  rather   sick james  ben white lol",-1,"Negatif"
"660","maddison doesnt get  look   doesnt fit  system  southgate isnt  good enough manager  th",2,"Positif"
"661"," euros didnt expose  levels liverpool made  look  opposite  bad last sea",-1,"Negatif"
"662","tyrone mings amp harry maguireone just beat man utdwhilst   couldnt get   utd xiguess ",0,"Netral"
"663","waking     watch southgates england yuno long",0,"Netral"
"664","frank   southgate going   sacked hint hint",0,"Netral"
"665"," jack bridge isnt   plane  qatar  southgates got   sacked hasnt ",0,"Netral"
"666","  good   squad  defense  start  southgate using back three     choic",1,"Positif"
"667","missing person   seen yo nyala pierre  last seen onnearsouthgate boulevard  north lauderda",0,"Netral"
"668","sky keeps using  worst photo  southgate ive ever seenhurr hurr hurr enghhrlund",-1,"Negatif"
"669"," final  never  reached penalties  scored afterminutes  southgate chose  try ",0,"Netral"
"670","assuming southgate goes  aid go  pickford trippier walker stones maguire",0,"Netral"
"671","tomori  definitely   ahead  guehi  im  sure southgate agreesgiven   fou",0,"Netral"
"672","listen   bro  clearly know   coach better  southgate  manager ",2,"Positif"
"673","southgate   bitch id  doesnt take  guy madders",-1,"Negatif"
"674","qatar world cup ambassador beckham  earnmillion  ten years    outrage   bbc  press",-1,"Negatif"
"675","sorry  say   southgate leaves maddison   takes maguire  trent  ive already lost faith",-1,"Negatif"
"676","  southgate  cocomms",0,"Netral"
"677","  chance boring southgate picksattackers jamie gonna   long run   christmas id say",-1,"Negatif"
"678","long   can  agree southgate  crap",-1,"Negatif"
"679","   back   pitch   next week     importance   t",0,"Netral"
"680","  southgate  charge  half decent team  fancy beating us tbh",2,"Positif"
"681","banditossouthgate house revival newport ky",1,"Positif"
"682","gary southgate",0,"Netral"
"683"," southgate  charge well  lucky  make  top",3,"Positif"
"684","without doubt  southgate   clown",-1,"Negatif"
"685","im   going  stand  another southgate gp better start connecting   club rather  t",1,"Positif"
"686","lets  honest southgate  going  start maguire   lacking  sort  match fitnesssharpness ahead  everyone",0,"Netral"
"687","dont want southgate anywhere near  anyway",0,"Netral"
"688","sterling right now    top player     southgate  wont select  ",2,"Positif"
"689","now   england squad    southgatenoticeable selectionsinben whitetomoriwilsonmaddis",0,"Netral"
"690","southgate needs timetime  science  develop brain transplants   can get  clue",0,"Netral"
"691","breaking gareth southgate  already finalised  man squad   world cup  made personal checks ",-1,"Negatif"
"692","gareth southgatewho inexplicably  na vely believes  workers  qatar  support",1,"Positif"
"693","gareth southgatewho inexplicably  na vely believes  workers  qatar  supp",0,"Netral"
"694","  one english player   never played  england    think   called   gareth sout",0,"Netral"
"695","argentina hahaha bro  feel like  finally coming home  southgate get  shit together",0,"Netral"
"696","still time  southgate  announcein  wc squad thursday",0,"Netral"
"697","agreed southgate  done  good job  terms  bringing  play",1,"Positif"
"698","southgate  example  necessarily ",0,"Netral"
"699","southgate playing maguire  dier   back  saka  lb",0,"Netral"
"700","southgate   worse  lampard imo",-1,"Negatif"
"701"," might  managers available  world cup southgate etc",1,"Positif"
"702","give southgate  ring  let  know chuba    plane",0,"Netral"
"703","wont take maddison southgate  boring doesnt want flair players thats  doesnt play grealis",-2,"Negatif"
"704","didnt know trent boycotted qatar thought southgate thought  wasnt good enough   squad",2,"Positif"
"705","looks really lackadaisical   games maybe saving energy   wc already mentioned southgate ",-1,"Negatif"
"706","southgate just pick  players  played well     past  never picks  form",1,"Positif"
"707","   massively overlooked kind    sight   mind dont see  southgate  justify taking maguire  ",0,"Netral"
"708","roll   world cup   can call  southgates head    weeks instead  richardsons",0,"Netral"
"709","justin  thought    gareth southgates man initial pool  playersbut  qatar dream looks   ",0,"Netral"
"710","robinson   awful turned back   mong   couple  seasons agoneed world cup  s",-1,"Negatif"
"711","southgate  wiser  potter   calling rlc",0,"Netral"
"712","tite  brazilian southgate",0,"Netral"
"713","madders    contender   pfa poty  southgate still wouldnt pick ",0,"Netral"
"714","southgate far  negativedefensively  poor  imo   way  get   latter stages  ",-1,"Negatif"
"715","taxis  southgate  town andfrom sandton  town   dramatic",0,"Netral"
"716","southgate gotta  one   worst england managers ever  weve   ",-1,"Negatif"
